,id,title,overview,release_date,original_language,vote_average,vote_count
0,550,Fight Club,"A ticking-time-bomb insomniac and a slippery soap salesman channel primal male aggression into a shocking new form of therapy. Their concept catches on, with underground ""fight clubs"" forming in every town, until an eccentric gets in the way and ignites an out-of-control spiral toward oblivion.",1999-10-15,en,8.438,30310
1,11216,Cinema Paradiso,"A filmmaker recalls his childhood, when he fell in love with the movies at his village's theater and formed a deep friendship with the theater's projectionist.",1988-11-17,it,8.437,4534
2,598,City of God,"In the poverty-stricken favelas of Rio de Janeiro in the 1970s, two young men choose different paths. Rocket is a budding photographer who documents the increasing drug-related violence of his neighborhood, while José “Zé” Pequeno is an ambitious drug dealer diving into a dangerous life of crime.",2002-08-30,pt,8.429,7655
3,40096,A Dog's Will,"The lively João Grilo and the sly Chicó are poor guys living in the hinterland who cheat a bunch of people in a small town in Northeastern Brazil. When they die, they have to be judged by Christ, the Devil and the Virgin Mary before they are admitted to paradise.",2000-09-15,pt,8.4,1160
4,539,Psycho,"When larcenous real estate clerk Marion Crane goes on the lam with a wad of cash and hopes of starting a new life, she ends up at the notorious Bates Motel, where manager Norman Bates cares for his housebound mother.",1960-06-22,en,8.4,10368
5,120,The Lord of the Rings: The Fellowship of the Ring,"Young hobbit Frodo Baggins, after inheriting a mysterious ring from his uncle Bilbo, must leave his home in order to keep it from falling into the hands of its evil creator. Along the way, a fellowship is formed to protect the ringbearer and make sure that the ring arrives at its final destination: Mt. Doom, the only place where it can be destroyed.",2001-12-18,en,8.421,25998
6,667257,Impossible Things,"After the death of her abusive husband, Matilde finds her new best friend in Miguel, her young, insecure, and disoriented neighbor.",2021-06-17,es,8.419,407
7,14537,Harakiri,"Down-on-his-luck veteran Tsugumo Hanshirō enters the courtyard of the prosperous House of Iyi. Unemployed, and with no family, he hopes to find a place to commit seppuku—and a worthy second to deliver the coup de grâce in his suicide ritual. The senior counselor for the Iyi clan questions the ronin’s resolve and integrity, suspecting Hanshirō of seeking charity rather than an honorable end. What follows is a pair of interlocking stories which lay bare the difference between honor and respect, and promises to examine the legendary foundations of the Samurai code.",1962-09-15,ja,8.414,1079
8,510,One Flew Over the Cuckoo's Nest,"A petty criminal fakes insanity to serve his sentence in a mental ward rather than prison. He soon finds himself as a leader to the other patients—and an enemy to the cruel, domineering nurse who runs the ward.",1975-11-19,en,8.413,10774
9,696374,Gabriel's Inferno,"An intriguing and sinful exploration of seduction, forbidden love, and redemption, Gabriel's Inferno is a captivating and wildly passionate tale of one man's escape from his own personal hell as he tries to earn the impossible--forgiveness and love.",2020-05-29,en,8.411,2420
10,311,Once Upon a Time in America,"A former Prohibition-era Jewish gangster returns to the Lower East Side of Manhattan over thirty years later, where he once again must confront the ghosts and regrets of his old life.",1984-05-23,en,8.407,5616
11,121,The Lord of the Rings: The Two Towers,"Frodo Baggins and the other members of the Fellowship continue on their sacred quest to destroy the One Ring--but on separate paths. Their destinies lie at two towers--Orthanc Tower in Isengard, where the corrupt wizard Saruman awaits, and Sauron's fortress at Barad-dur, deep within the dark lands of Mordor. Frodo and Sam are trekking to Mordor to destroy the One Ring of Power while Gimli, Legolas and Aragorn search for the orc-captured Merry and Pippin. All along, nefarious wizard Saruman awaits the Fellowship members at the Orthanc Tower in Isengard.",2002-12-18,en,8.405,22600
12,324857,Spider-Man: Into the Spider-Verse,"Struggling to find his place in the world while juggling school and family, Brooklyn teenager Miles Morales is unexpectedly bitten by a radioactive spider and develops unfathomable powers just like the one and only Spider-Man. While wrestling with the implications of his new abilities, Miles discovers a super collider created by the madman Wilson ""Kingpin"" Fisk, causing others from across the Spider-Verse to be inadvertently transported to his dimension.",2018-12-06,en,8.398,16152
13,4935,Howl's Moving Castle,"Sophie, a young milliner, is turned into an elderly woman by a witch who enters her shop and curses her. She encounters a wizard named Howl and gets caught up in his resistance to fighting for the king.",2004-09-09,ja,8.396,10311
14,255709,Hope,"After 8-year-old So-won narrowly survives a brutal sexual assault, her family labors to help her heal while coping with their own rage and grief.",2013-10-02,ko,8.4,778
15,1891,The Empire Strikes Back,"The epic saga continues as Luke Skywalker, in hopes of defeating the evil Galactic Empire, learns the ways of the Jedi from aging master Yoda. But Darth Vader is more determined than ever to capture Luke. Meanwhile, rebel leader Princess Leia, cocky Han Solo, Chewbacca, and droids C-3PO and R2-D2 are thrown into various stages of capture, betrayal and despair.",1980-05-20,en,8.394,17424
16,378064,A Silent Voice: The Movie,"Shouya Ishida starts bullying the new girl in class, Shouko Nishimiya, because she is deaf. But as the teasing continues, the rest of the class starts to turn on Shouya for his lack of compassion. When they leave elementary school, Shouko and Shouya do not speak to each other again... until an older, wiser Shouya, tormented by his past behaviour, decides he must see Shouko once more. He wants to atone for his sins, but is it already too late...?",2016-09-17,ja,8.385,4128
17,724089,Gabriel's Inferno: Part II,"Professor Gabriel Emerson finally learns the truth about Julia Mitchell's identity, but his realization comes a moment too late. Julia is done waiting for the well-respected Dante specialist to remember her and wants nothing more to do with him. Can Gabriel win back her heart before she finds love in another's arms?",2020-07-31,en,8.38,1522
18,423,The Pianist,"The true story of pianist Władysław Szpilman's experiences in Warsaw during the Nazi occupation. When the Jews of the city find themselves forced into a ghetto, Szpilman finds work playing in a café; and when his family is deported in 1942, he stays behind, works for a while as a laborer, and eventually goes into hiding in the ruins of the war-torn city.",2002-09-17,en,8.379,9538
19,761053,Gabriel's Inferno: Part III,The final part of the film adaption of the erotic romance novel Gabriel's Inferno written by an anonymous Canadian author under the pen name Sylvain Reynard.,2020-11-19,en,8.376,1058
20,10494,Perfect Blue,"Encouraged by her managers, rising pop star Mima takes on a recurring role on a popular TV show, when suddenly her handlers and collaborators begin turning up murdered.",1998-02-28,ja,8.3,2824
21,207,Dead Poets Society,"At an elite, old-fashioned boarding school in New England, a passionate English teacher inspires his students to rebel against convention and seize the potential of every day, courting the disdain of the stern headmaster.",1989-06-02,en,8.302,11667
22,101,Léon: The Professional,"Léon, the top hit man in New York, has earned a rep as an effective ""cleaner"". But when his next-door neighbors are wiped out by a loose-cannon DEA agent, he becomes the unwilling custodian of 12-year-old Mathilda. Before long, Mathilda's thoughts turn to revenge, and she considers following in Léon's footsteps.",1994-09-14,fr,8.301,15219
23,652837,"Josee, the Tiger and the Fish","With dreams of diving abroad, Tsuneo gets a job assisting Josee, an artist whose imagination takes her far beyond her wheelchair. But when the tide turns against them, they push each other to places they never thought possible, and inspire a love fit for a storybook.",2020-12-25,ja,8.299,502
24,914,The Great Dictator,Dictator Adenoid Hynkel tries to expand his empire while a poor Jewish barber tries to avoid persecution from Hynkel's regime.,1940-10-15,en,8.3,3462
25,644479,Dedicated to my ex,"The film tells the story of Ariel, a 21-year-old who decides to form a rock band to compete for a prize of ten thousand dollars in a musical band contest, this as a last option when trying to get money to save their relationship and reunite with his ex-girlfriend, which breaks due to the trip she must make to Finland for an internship. Ariel with her friend Ortega, decides to make a casting to find the other members of the band, although they do not know nothing about music, thus forming a band with members that have diverse and opposite personalities.",2019-11-01,es,8.292,508
26,599,Sunset Boulevard,A hack screenwriter writes a screenplay for a former silent film star who has faded into Hollywood obscurity.,1950-08-10,en,8.291,2687
27,1139087,Once Upon a Studio,"Created for Disney's 100th anniversary, the short features Mickey Mouse corralling a gallery of legendary Disney characters for a group photo.",2023-09-24,en,8.283,389
28,18491,Neon Genesis Evangelion: The End of Evangelion,"SEELE orders an all-out attack on NERV, aiming to destroy the Evas before Gendo can advance his own plans for the Human Instrumentality Project. Shinji is pushed to the limits of his sanity as he is forced to decide the fate of humanity.",1997-07-19,ja,8.283,1684
29,335,Once Upon a Time in the West,"As the railroad builders advance unstoppably through the Arizona desert on their way to the sea, Jill arrives in the small town of Flagstone with the intention of starting a new life.",1968-12-21,it,8.3,4536
30,92321,Hotarubi no Mori e,"One hot summer day a little girl gets lost in an enchanted forest of the mountain god where spirits reside. A young boy appears before her, but she cannot touch him for fear of making him disappear. And so a wondrous adventure awaits...",2011-09-17,ja,8.279,1145
31,42269,We All Loved Each Other So Much,"Three partisans bound by a strong friendship return home after the war, but the clash with everyday reality puts a strain on their bond.",1974-12-21,it,8.3,592
32,3082,Modern Times,"A bumbling tramp desires to build a home with a young woman, yet is thwarted time and time again by his lack of experience and habit of being in the wrong place at the wrong time..",1936-02-05,en,8.3,3812
33,1585,It's a Wonderful Life,"A holiday favourite for generations...  George Bailey has spent his entire life giving to the people of Bedford Falls.  All that prevents rich skinflint Mr. Potter from taking over the entire town is George's modest building and loan company.  But on Christmas Eve the business's $8,000 is lost and George's troubles begin.",1946-12-20,en,8.278,4503
34,632632,Given,"Haruki secretly had feelings for Akihiko for years, but Akihiko was still in a relationship with his roommate, the violinist Ugetsu Murata. Haruki, Akihiko, and Ugetsu's love clashes and starts to move forward.",2020-08-22,ja,8.3,400
35,533514,Violet Evergarden: The Movie,"As the world moves on from the war and technological advances bring changes to her life, Violet still hopes to see her lost commanding officer again.",2020-09-18,ja,8.272,446
36,77338,The Intouchables,A true story of two men who should never have met – a quadriplegic aristocrat who was injured in a paragliding accident and a young man from the projects.,2011-11-02,fr,8.272,17627
37,28,Apocalypse Now,"At the height of the Vietnam war, Captain Benjamin Willard is sent on a dangerous mission that, officially, ""does not exist, nor will it ever exist."" His goal is to locate - and eliminate - a mysterious Green Beret Colonel named Walter Kurtz, who has been leading his personal army on illegal guerrilla missions into enemy territory.",1979-05-19,en,8.271,8505
38,901,City Lights,A tramp falls in love with a beautiful blind flower girl. His on-and-off friendship with a wealthy man allows him to be the girl's benefactor and suitor.,1931-02-06,en,8.3,2263
39,8587,The Lion King,"Young lion prince Simba, eager to one day become king of the Pride Lands, grows up under the watchful eye of his father Mufasa; all the while his villainous uncle Scar conspires to take the throne for himself. Amid betrayal and tragedy, Simba must confront his past and find his rightful place in the Circle of Life.",1994-06-15,en,8.258,18768
40,24188,Il Sorpasso,"Roberto, a shy law student in Rome, meets Bruno, a forty-year-old exuberant, capricious man, who takes him for a drive through the Roman and Tuscany countries in the summer. When their journey starts to blend into their daily lives though, the pair’s newfound friendship is tested.",1962-12-05,it,8.2,793
41,995133,"The Boy, the Mole, the Fox and the Horse","The unlikely friendship of a boy, a mole, a fox and a horse traveling together in the boy's search for home.",2022-12-25,en,8.223,633
42,618344,Justice League Dark: Apokolips War,"Earth is decimated after intergalactic tyrant Darkseid has devastated the Justice League in a poorly executed war by the DC Super Heroes. Now the remaining bastions of good – the Justice League, Teen Titans, Suicide Squad and assorted others – must regroup, strategize and take the war to Darkseid in order to save the planet and its surviving inhabitants.",2020-05-05,en,8.2,1491
43,110420,Wolf Children,"After her werewolf lover unexpectedly dies in an accident, a woman must find a way to raise the son and daughter that she had with him. However, their inheritance of their father's traits prove to be a challenge for her.",2012-07-21,ja,8.2,2333
44,98,Gladiator,"After the death of Emperor Marcus Aurelius, his devious son takes power and demotes Maximus, one of Rome's most capable generals who Marcus preferred. Eventually, Maximus is forced to become a gladiator and battle to the death against other men for the amusement of paying audiences.",2000-05-04,en,8.221,19729
45,857,Saving Private Ryan,"As U.S. troops storm the beaches of Normandy, three brothers lie dead on the battlefield, with a fourth trapped behind enemy lines. Ranger captain John Miller and seven men are tasked with penetrating German-held territory and bringing the boy home.",1998-07-24,en,8.218,16305
46,315162,Puss in Boots: The Last Wish,"Puss in Boots discovers that his passion for adventure has taken its toll: He has burned through eight of his nine lives, leaving him with only one life left. Puss sets out on an epic journey to find the mythical Last Wish and restore his nine lives.",2022-12-07,en,8.216,8210
47,441130,Wolfwalkers,"In a time of superstition and magic, when wolves are seen as demonic and nature an evil to be tamed, a young apprentice hunter comes to Ireland with her father to wipe out the last pack. But when she saves a wild native girl, their friendship leads her to discover the world of the Wolfwalkers and transform her into the very thing her father is tasked to destroy.",2020-10-26,en,8.2,1259
48,16869,Inglourious Basterds,"In Nazi-occupied France during World War II, a group of Jewish-American soldiers known as ""The Basterds"" are chosen specifically to spread fear throughout the Third Reich by scalping and brutally killing Nazis. The Basterds, lead by Lt. Aldo Raine soon cross paths with a French-Jewish teenage girl who runs a movie theater in Paris which is targeted by the soldiers.",2009-08-02,en,8.215,22877
49,16672,Woman in the Dunes,A vacationing entomologist suffers extreme physical and psychological trauma after being taken captive by the residents of a poor seaside village and made to live with a woman whose life task is shoveling sand for them.,1964-02-15,ja,8.2,473
50,37257,Witness for the Prosecution,An ailing famous barrister agrees to defend a man in a sensational murder trial where his self-possessed wife's unconvincing testimony confuses him.,1957-12-17,en,8.2,1485
51,694,The Shining,"Jack Torrance accepts a caretaker job at the Overlook Hotel, where he, along with his wife Wendy and their son Danny, must live isolated from the rest of the world for the winter. But they aren't prepared for the madness that lurks within.",1980-05-23,en,8.212,17956
52,1160164,TAYLOR SWIFT | THE ERAS TOUR,"A concert film documenting Taylor Swift's record-breaking Eras Tour (2023-2024). Filmed during the Los Angeles shows, the film captures the tour's ten acts, each representing a different musical era from Swift's career. The film showcases over 40 songs, elaborate stage productions, and Swift's performance.",2023-10-13,en,8.2,447
53,635302,Demon Slayer -Kimetsu no Yaiba- The Movie: Mugen Train,"Tanjiro Kamado, joined with Inosuke Hashibira, a boy raised by boars who wears a boar's head, and Zenitsu Agatsuma, a scared boy who reveals his true power when he sleeps, boards the Infinity Train on a new mission with the Fire Hashira, Kyojuro Rengoku, to defeat a demon who has been tormenting the people and killing the demon slayers who oppose it!",2020-10-16,ja,8.21,4093
54,50014,The Help,"Aibileen Clark is a middle-aged African-American maid who has spent her life raising white children and has recently lost her only son; Minny Jackson is an African-American maid who has often offended her employers despite her family's struggles with money and her desperate need for jobs; and Eugenia ""Skeeter"" Phelan is a young white woman who has recently moved back home after graduating college to find out her childhood maid has mysteriously disappeared. These three stories intertwine to explain how life in Jackson, Mississippi revolves around ""the help""; yet they are always kept at a certain distance because of racial lines.",2011-08-09,en,8.207,8557
55,354912,Coco,"Despite his family’s baffling generations-old ban on music, Miguel dreams of becoming an accomplished musician like his idol, Ernesto de la Cruz. Desperate to prove his talent, Miguel finds himself in the stunning and colorful Land of the Dead following a mysterious chain of events. Along the way, he meets charming trickster Hector, and together, they set off on an extraordinary journey to unlock the real story behind Miguel's family history.",2017-10-27,en,8.205,19980
56,11,Star Wars,Princess Leia is captured and held hostage by the evil Imperial forces in their effort to take over the galactic Empire. Venturesome Luke Skywalker and dashing captain Han Solo team together with the loveable robot duo R2-D2 and C-3PO to rescue the beautiful princess and restore peace and justice in the Empire.,1977-05-25,en,8.2,21176
57,1124,The Prestige,"A mysterious story of two magicians whose intense rivalry leads them on a life-long battle for supremacy -- full of obsession, deceit and jealousy with dangerous and deadly consequences.",2006-10-17,en,8.204,16533
58,290098,The Handmaiden,"1930s Korea, in the period of Japanese occupation, a new girl, Sookee, is hired as a handmaiden to a Japanese heiress, Hideko, who lives a secluded life on a large countryside estate with her domineering Uncle Kouzuki. But the maid has a secret. She is a pickpocket recruited by a swindler posing as a Japanese Count to help him seduce the Lady to elope with him, rob her of her fortune, and lock her up in a madhouse. The plan seems to proceed according to plan until Sookee and Hideko discover some unexpected emotions.",2016-06-01,ko,8.203,3935
59,522924,The Art of Racing in the Rain,"A family dog – with a near-human soul and a philosopher's mind – evaluates his life through the lessons learned by his human owner, a race-car driver.",2019-08-08,en,8.202,1527
60,11324,Shutter Island,"World War II soldier-turned-U.S. Marshal Teddy Daniels investigates the disappearance of a patient from a hospital for the criminally insane, but his efforts are compromised by troubling visions and a mysterious doctor.",2010-02-14,en,8.201,24556
61,92060,Michael Jackson's Thriller,"A night at the movies turns into a nightmare when Michael and his date are attacked by a horde of bloody-thirsty zombies. On top of the success of the Thriller album and Michael Jackson's electrifying performance at Motown 25, the short film/music video for ""Thriller"" established Jackson as an international superstar and global phenomenon. Thriller is credited for transforming music videos into a serious art form, breaking down racial barriers in popular entertainment, popularizing the making-of documentary format and creating a home video market. The success transformed Jackson into a dominant force in global pop culture. In 2009, it became the first music video inducted into the United States National Film Registry by the Library of Congress as ""culturally, historically or aesthetically significant"". ""Thriller"" was also Jackson's seventh and final U.S. Hot 100 Top 10 hit from the Thriller album. It was the first album in history to have seven U.S. Top 10s.",1983-11-14,en,8.198,706
62,284,The Apartment,"Bud Baxter is a minor clerk in a huge New York insurance company, until he discovers a quick way to climb the corporate ladder. He lends out his apartment to the executives as a place to take their mistresses. Although he often has to deal with the aftermath of their visits, one night he's left with a major problem to solve.",1960-06-21,en,8.2,2418
63,620683,My Mom Is a Character 3,Dona Hermínia will have to rediscover and reinvent herself because her children are forming new families. This supermom will have to deal with a new life scenario: Marcelina is pregnant and Juliano is getting married.,2019-12-26,pt,8.194,479
64,313106,Doctor Who: The Day of the Doctor,"In 2013, something terrible is awakening in London's National Gallery; in 1562, a murderous plot is afoot in Elizabethan England; and somewhere in space an ancient battle reaches its devastating conclusion. All of reality is at stake as the Doctor's own dangerous past comes back to haunt him.",2013-11-23,en,8.194,755
65,324786,Hacksaw Ridge,"WWII American Army Medic Desmond T. Doss, who served during the Battle of Okinawa, refuses to kill people and becomes the first Conscientious Objector in American history to receive the Congressional Medal of Honor.",2016-10-07,en,8.193,14109
66,476292,Maquia: When the Promised Flower Blooms,"Maquia is a member of a special race called the Iorph who can live for hundreds of years. However, Maquia has always felt lonely despite being surrounded by her people, as she was orphaned from a young age. She daydreams about the outside world, but dares not travel from her home due to the warnings of the clan's chief.  One day the kingdom of Mezarte invades her homeland. They already have what is left of the giant dragons, the Renato, under their control, and now their king wishes to add the immortality to his bloodline.  They ravage the Iorph homeland and kill most of its inhabitants. Caught in the midst of the attack, Maquia is carried off by one of the Renato. It soon dies, and she is left deserted in a forest, now truly alone save for the cries of a single baby off in the distance. Maquia finds the baby in a destroyed village and decides to raise him as her own, naming him Ariel. Although she knows nothing of the human world, how to raise a child that ages much faster than her.",2018-02-24,ja,8.2,647
67,185,A Clockwork Orange,"In a near-future Britain, young Alexander DeLarge and his pals get their kicks beating and raping anyone they please. When not destroying the lives of others, Alex swoons to the music of Beethoven. The state, eager to crack down on juvenile crime, gives an incarcerated Alex the option to undergo an invasive procedure that'll rob him of all personal agency. In a time when conscience is a commodity, can Alex change his tune?",1971-12-19,en,8.186,13188
68,490,The Seventh Seal,"When disillusioned Swedish knight Antonius Block returns home from the Crusades to find his country in the grips of the Black Death, he challenges Death to a chess match for his life. Tormented by the belief that God does not exist, Block sets off on a journey, meeting up with traveling players Jof and his wife, Mia, and becoming determined to evade Death long enough to commit one redemptive act while he still lives.",1957-02-16,sv,8.2,3100
69,829402,Ultraman: Rising,"A star athlete reluctantly returns home to take over his father's duties as Ultraman, shielding Tokyo from giant monsters as he becomes a legendary hero.",2024-06-14,en,8.2,322
70,68718,Django Unchained,"With the help of a German bounty hunter, a freed slave sets out to rescue his wife from a brutal Mississippi plantation owner.",2012-12-25,en,8.183,26783
71,823219,Flow,"A solitary cat, displaced by a great flood, finds refuge on a boat with various species and must navigate the challenges of adapting to a transformed world together.",2024-08-29,lv,8.179,1991
72,77,Memento,"Leonard Shelby is tracking down the man who raped and murdered his wife. The difficulty of locating his wife's killer, however, is compounded by the fact that he suffers from a rare, untreatable form of short-term memory loss. Although he can recall details of life before his accident, Leonard cannot remember what happened fifteen minutes ago, where he's going, or why.",2000-10-11,en,8.178,15310
73,851644,20th Century Girl,"In 1999, a teen girl keeps close tabs on a boy in school on behalf of her deeply smitten best friend – then she gets swept up in a love story of her own.",2022-10-06,ko,8.2,730
