,id,title,overview,release_date,original_language,vote_average,vote_count
306,33320,Millennium Actress,"Documentary filmmaker Genya Tachibana has tracked down the legendary actress Chiyoko Fujiwara, who mysteriously vanished at the height of her career. When he presents her with a key she had lost and thought was gone forever, the filmmaker could not have imagined that it would not only unlock the long-held secrets of Chiyoko’s life... but also his own.",2002-09-14,ja,7.838,907
307,714888,Argentina 1985,"In the 1980s, a team of lawyers takes on the heads of Argentina's bloody military dictatorship in a battle against odds and a race against time.",2022-09-29,es,7.837,667
308,527774,Raya and the Last Dragon,"Long ago, in the fantasy world of Kumandra, humans and dragons lived together in harmony. But when an evil force threatened the land, the dragons sacrificed themselves to save humanity. Now, 500 years later, that same evil has returned and it’s up to a lone warrior, Raya, to track down the legendary last dragon to restore the fractured land and its divided people.",2021-03-03,en,7.836,6938
309,115,The Big Lebowski,"Jeffrey 'The Dude' Lebowski, a Los Angeles slacker who only wants to bowl and drink White Russians, is mistaken for another Jeffrey Lebowski, a wheelchair-bound millionaire, and finds himself dragged into a strange series of events involving nihilists, adult film producers, ferrets, errant toes, and large sums of money.",1998-03-06,en,7.837,11511
310,185789,Mulholland Dr.,"Initially, ""Mulholland Dr."" was to mark David Lynch's return to television. It is a retooling of a script originally shot as a 94-minute pilot for a TV series (co-written with TV screenwriter Joyce Eliason) for the channel ABC, which had approved the script, but chose not even to air the pilot once it was done in 1999, despite Lynch's labours to cut the project to their liking. It was left in limbo until 18 month later French company Studio Canal Plus (also producer of 'The Straight Story') agreed to pay ABC $7 million for the pilot, and budget a few million more to turn the pilot into a two-hour, 27-minute movie. The cost of the film doubled to $14 million as sets had to be reconstructed and actors recalled.",1999-01-01,en,7.836,503
311,677638,We Bare Bears: The Movie,"When Grizz, Panda, and Ice Bear's love of food trucks and viral videos get out of hand, the brothers are now chased away from their home and embark on a trip to Canada, where they can live in peace.",2020-06-30,en,7.835,818
312,9479,The Nightmare Before Christmas,"Tired of scaring humans every October 31 with the same old bag of tricks, Jack Skellington, the spindly king of Halloween Town, kidnaps Santa Claus and plans to deliver shrunken heads and other ghoulish gifts to children on Christmas morning. But as Christmas approaches, Jack's rag-doll girlfriend, Sally, tries to foil his misguided plans.",1993-10-09,en,7.835,9769
313,6075,Carlito's Way,"Free after years in prison, Carlito Brigante intends to give up his criminal ways, but it's not long before the ex-con is sucked back into the New York City underworld. Reconnecting with his dancer girlfriend, Carlito gets entangled in the shady dealings of his friend Dave Kleinfeld, who also serves as his lawyer. An encounter with shifty gangster Benny Blanco sets the duo on a dangerous path.",1993-11-10,en,7.832,3255
314,391,A Fistful of Dollars,"The Man With No Name enters the Mexican village of San Miguel in the midst of a power struggle among the three Rojo brothers and sheriff John Baxter. When a regiment of Mexican soldiers bearing gold intended to pay for new weapons is waylaid by the Rojo brothers, the stranger inserts himself into the middle of the long-simmering battle, selling false information to both sides for his own benefit.",1964-09-12,it,7.832,4399
315,698508,Redeeming Love,A retelling of the biblical book of Hosea set against the backdrop of the California Gold Rush of 1850.,2022-01-21,en,7.831,625
316,32480,The Marquis of Grillo,"In 18th-century Rome, impish aristocrat Onofrio del Grillo amuses himself by playing pranks on all sorts of people — his reactionary family and fellow nobles, the poors, the French occupiers trying to modernize society, and even the Pope himself.",1981-12-23,it,7.831,474
317,5924,Papillon,"A man befriends a fellow criminal as the two of them begin serving their sentence on a dreadful prison island, which inspires the man to plot his escape.",1973-12-16,en,7.83,1970
318,552532,Charm City Kings,"Mouse desperately wants to join The Midnight Clique, the infamous Baltimore dirt bike riders who rule the summertime streets. When Midnight’s leader, Blax, takes 14-year-old Mouse under his wing, Mouse soon finds himself torn between the straight-and-narrow and a road filled with fast money and violence.",2020-01-27,en,7.829,480
319,3078,It Happened One Night,A runaway heiress makes a deal with the rogue reporter trailing her but the mismatched pair end up stuck with each other when their bus leaves them behind.,1934-02-22,en,7.8,1299
320,631,Sunrise: A Song of Two Humans,"A married farmer falls under the spell of a slatternly woman from the city, who tries to convince him to drown his wife.",1927-11-04,en,7.8,830
321,198,To Be or Not to Be,"During the Nazi occupation of Poland, an acting troupe becomes embroiled in a Polish soldier's efforts to track down a German spy.",1942-03-06,en,7.8,762
322,25606,Fantozzi: White Collar Blues,"A good-natured but unlucky Italian is constantly going on a difficult situations, but never lose his mood.",1975-03-27,it,7.827,834
323,24167,Two Women,A young widow flees from Rome during WWII and takes her lonely twelve-year-old-daughter to her rural hometown but the horrors of war soon catch up with them.,1960-12-22,it,7.827,544
324,14574,The Boy in the Striped Pyjamas,"When his family moves from their home in Berlin to a strange new house in Poland, young Bruno befriends Shmuel, a boy who lives on the other side of the fence where everyone seems to be wearing striped pajamas. Unaware of Shmuel's fate as a Jewish prisoner or the role his own Nazi father plays in his imprisonment, Bruno embarks on a dangerous journey inside the camp's walls.",2008-05-07,en,7.8,7332
325,2062,Ratatouille,"Remy, a resident of Paris, appreciates good food and has quite a sophisticated palate. He would love to become a chef so he can create and enjoy culinary masterpieces to his heart's delight. The only problem is, Remy is a rat. When he winds up in the sewer beneath one of Paris' finest restaurants, the rodent gourmet finds himself ideally placed to realize his dream.",2007-06-28,en,7.827,17509
326,83564,La luna,"A young boy comes of age in the most peculiar of circumstances. Tonight is the very first time his Papa and Grandpa are taking him to work. In an old wooden boat they row far out to sea, and with no land in sight, they stop and wait. A big surprise awaits the boy as he discovers his family's most unusual line of work. Should he follow the example of his Papa, or his Grandpa? Will he be able to find his own way in the midst of their conflicting opinions and timeworn traditions?",2012-02-10,en,7.826,811
327,47931,Elite Squad: The Enemy Within,"After a bloody invasion of the BOPE in the High-Security Penitentiary Bangu 1 in Rio de Janeiro to control a rebellion of interns, the Lieutenant-Colonel Roberto Nascimento and the second in command Captain André Matias are accused by the Human Right Aids member Diogo Fraga of execution of prisoners. Matias is transferred to the corrupted Military Police and Nascimento is exonerated from the BOPE by the Governor.",2010-10-08,pt,7.825,1907
328,16859,Kiki's Delivery Service,"A young witch, on her mandatory year of independent life, finds fitting into a new community difficult while she supports herself by running an air courier service.",1989-07-29,ja,7.824,4224
329,2440,Joint Security Area,"Two North Korean soldiers are killed in the border area between North and South Korea, prompting an investigation by a neutral body. The sergeant is the shooter, but the lead investigator, a Swiss-Korean woman, receives differing accounts from the two sides.",2000-09-09,ko,7.825,738
330,805,Rosemary's Baby,"A young couple, Rosemary and Guy, moves into an infamous New York apartment building, known by frightening legends and mysterious events, with the purpose of starting a family.",1968-06-12,en,7.825,4052
331,445030,No Game No Life: Zero,"Six thousand years before Sora and Shiro were even a blink in the history of Disboard, war consumed the land, tearing apart the heavens, destroying stars, and even threatening to wipe out the human race. Amid the chaos and destruction, a young man named Riku leads humanity toward the tomorrow his heart believes in. One day, in the ruins of an Elf city, he meets Schwi, a female exiled ""Ex Machina"" android who asks him to teach her what it means to have a human heart.",2017-07-15,ja,7.8,407
332,435129,The Breadwinner,"A headstrong young girl in Afghanistan, ruled by the Taliban, disguises herself as a boy in order to provide for her family.",2017-11-17,en,7.8,858
333,152742,The Best Offer,"Virgil Oldman is a world renowned antiques expert and auctioneer. An eccentric genius, he leads a solitary life, going to extreme lengths to keep his distance from the messiness of human relationships. When appointed by the beautiful but emotionally damaged Claire to oversee the valuation and sale of her family’s priceless art collection, Virgil allows himself to form an attachment to her – and soon he is engulfed by a passion which will rock his bland existence to the core.",2013-01-01,it,7.823,2895
334,1394,Nostalgia,"A Russian poet, Andrei and his interpreter, Eugenia travel to Italy to research the life of an 18th-century composer.",1983-06-02,ru,7.823,549
335,594634,Close to the Horizon,Jessica knows exactly what her life is supposed to look like and where it takes her. But then she meets Danny. He has a complicated past and could confuse all their plans. Jessica has to decide.,2019-10-10,de,7.822,491
336,52345,Lisbela and the Prisoner,"Lisbela is a young woman who loves going to the movies. Leléu is a con man, going from town to town selling all sort of things and performing as master of ceremonies for some cheesy numbers, such as the woman who gets transformed into a gorilla. He gets involved with Linaura, a sexy and beautiful woman who happens to be the wife of the most frightening hitman of the place. The hitman finds out his wife's affair and goes after Leléu, who has to leave in a hurry. In another town, he meets and falls instantly in love with Lisbela, who is engaged to Douglas, a hillbilly who tries hard to pass for a cosmopolitan Rio de Janeiro dweller.",2003-08-22,pt,7.8,388
337,263115,Logan,"In the near future, a weary Logan cares for an ailing Professor X in a hideout on the Mexican border. But Logan's attempts to hide from the world and his legacy are upended when a young mutant arrives, pursued by dark forces.",2017-02-28,en,7.821,19628
338,200727,"Love, Rosie","Since the moment they met at age 5, Rosie and Alex have been best friends, facing the highs and lows of growing up side by side. A fleeting shared moment, one missed opportunity, and the decisions that follow send their lives in completely different directions. As each navigates the complexities of life, love, and everything in between, they always find their way back to each other - but is it just friendship, or something more?",2014-10-16,en,7.82,6306
339,3870,1900,"The epic tale of a class struggle in twentieth century Italy, as seen through the eyes of two childhood friends on opposing sides.",1976-08-28,it,7.8,643
340,650031,The Shadow in My Eye,"On March 21st, 1945, the British Royal Air Force set out on a mission to bomb Gestapo's headquarters in Copenhagen. The raid had fatal consequences as some of the bombers accidentally targeted a school and more than 120 people were killed, 86 of whom were children.",2021-10-28,da,7.819,508
341,398924,A Bag of Marbles,"At the beginning of the 1940s, in a France occupied by Nazi forces, lived the Jewish Joffo family. Happy and tight-knit, she sees her future darken when all members of the family are forced to wear the yellow star. Fearing the worst, the parents organized their family to flee to the free zone in the south of the country. Maurice, twelve years old, and Joseph, ten years old, will therefore leave alone in order to maximize their chances of finding their older brothers already settled in Nice.  The brothers left to their own devices demonstrate an incredible amount of cleverness, courage, and ingenuity to escape the enemy invasion and to try to reunite their family once again.",2017-01-18,fr,7.819,867
342,10775,Infernal Affairs,"Chan Wing Yan, a young police officer, has been sent undercover as a mole in the local mafia. Lau Kin Ming, a young mafia member, infiltrates the police force. Years later, their older counterparts, Chen Wing Yan and Inspector Lau Kin Ming, respectively, race against time to expose the mole within their midst.",2002-12-12,cn,7.819,1695
343,31442,Ivan's Childhood,"In WW2, twelve year old Soviet orphan Ivan Bondarev works for the Soviet army as a scout behind the German lines and strikes a friendship with three sympathetic Soviet officers.",1962-05-09,ru,7.818,760
344,1280,3-Iron,A drifter lives in people's houses while they are away and repays them by doing chores for them. His life changes when he meets a beautiful woman who wants to escape her unhappy marriage.,2004-10-15,ko,7.8,1178
345,596,The Grapes of Wrath,"Tom Joad returns to his home after a jail sentence to find his family kicked out of their farm due to foreclosure. He catches up with them on his Uncle’s farm, and joins them the next day as they head for California and a new life... Hopefully.",1940-03-15,en,7.8,1021
346,11953,Kagemusha,"Akira Kurosawa's lauded feudal epic presents the tale of a petty thief who is recruited to impersonate Shingen, an aging warlord, in order to avoid attacks by competing clans. When Shingen dies, his generals reluctantly agree to have the impostor take over as the powerful ruler. He soon begins to appreciate life as Shingen, but his commitment to the role is tested when he must lead his troops into battle against the forces of a rival warlord.",1980-04-26,ja,7.8,673
347,12,Finding Nemo,"Nemo, an adventurous young clownfish, is unexpectedly taken from his Great Barrier Reef home to a dentist's office aquarium. It's up to his worrisome father Marlin and a friendly but forgetful fish Dory to bring Nemo home -- meeting vegetarian sharks, surfer dude turtles, hypnotic jellyfish, hungry seagulls, and more along the way.",2003-05-30,en,7.816,19673
348,785084,The Whale,A reclusive English teacher suffering from severe obesity attempts to reconnect with his estranged teenage daughter for one last chance at redemption.,2022-12-09,en,7.815,4181
349,314365,Spotlight,"The true story of how the Boston Globe uncovered the massive scandal of child molestation and cover-up within the local Catholic Archdiocese, shaking the entire Catholic Church to its core.",2015-11-06,en,7.814,8387
350,779047,Us Again,"In a vibrant city pulsating with rhythm and movement, an elderly man and his young-at-heart wife rekindle their youthful passion for life and each other on one magical night.",2021-03-03,en,7.8,332
351,419478,Midnight Sun,"Katie, a 17-year-old, has been sheltered since childhood and confined to her house during the day by a rare disease that makes even the smallest amount of sunlight deadly. Fate intervenes when she meets Charlie and they embark on a summer romance.",2018-03-22,en,7.813,3473
352,303867,World of Tomorrow,A little girl is taken on a mind-bending tour of her distant future.,2015-01-22,en,7.813,336
353,4977,Paprika,"When a machine that allows therapists to enter their patient's dreams is stolen, all hell breaks loose. Only a young female therapist can stop it and recover it before damage is done: Paprika.",2006-10-01,ja,7.812,2578
354,107,Snatch,"Unscrupulous boxing promoters, violent bookmakers, a Russian gangster, incompetent amateur robbers and supposedly Jewish jewelers fight to track down a priceless stolen diamond.",2000-09-01,en,7.812,9323
355,31011,Mr. Nobody,"Nemo Nobody leads an ordinary existence with his wife and 3 children; one day, he wakes up as a mortal centenarian in the year 2092.",2009-11-06,en,7.811,5941
356,826,The Bridge on the River Kwai,"The classic story of English POWs in Burma forced to build a bridge to aid the war effort of their Japanese captors. British and American intelligence officers conspire to blow up the structure, but Col. Nicholson, the commander who supervised the bridge's construction, has acquired a sense of pride in his creation and tries to foil their plans.",1957-10-11,en,7.811,2187
357,22,Pirates of the Caribbean: The Curse of the Black Pearl,"After Port Royal is attacked and pillaged by a mysterious pirate crew, capturing the governor's daughter Elizabeth Swann in the process, William Turner asks free-willing pirate Jack Sparrow to help him locate the crew's ship—The Black Pearl—so that he can rescue the woman he loves.",2003-07-09,en,7.811,21147
358,56231,The Working Class Goes to Heaven,"After losing a finger in a work accident, an Italian worker becomes increasingly involved in political and revolutionary groups.",1971-09-17,it,7.81,358
359,1018,Mulholland Drive,"Blonde Betty Elms has only just arrived in Hollywood to become a movie star when she meets an enigmatic brunette with amnesia. Meanwhile, as the two set off to solve the second woman's identity, filmmaker Adam Kesher runs into ominous trouble while casting his latest project.",2001-06-06,en,7.808,6521
360,80,Before Sunset,"Nine years later, Jesse travels across Europe giving readings from a book he wrote about the night he spent in Vienna with Celine. After his reading in Paris, Celine finds him, and they spend part of the day together before Jesse has to again leave for a flight. They are both in relationships now, and Jesse has a son, but as their strong feelings for each other start to return, both confess a longing for more.",2004-06-16,en,7.808,3501
361,10774,Network,"When veteran anchorman Howard Beale is forced to retire his 25-year post because of his age, he announces to viewers that he will kill himself during his farewell broadcast. Network executives rethink their decision when his fanatical tirade results in a spike in ratings.",1976-11-14,en,7.807,1824
362,1010581,My Fault,"Noah must leave her city, boyfriend, and friends to move into William Leister's mansion, the flashy and wealthy husband of her mother Rafaela. As a proud and independent 17 year old, Noah resists living in a mansion surrounded by luxury. However, it is there where she meets Nick, her new stepbrother, and the clash of their strong personalities becomes evident from the very beginning.",2023-06-08,es,7.806,3698
363,10315,Fantastic Mr. Fox,"The Fantastic Mr. Fox, bored with his current life, plans a heist against the three local farmers. The farmers, tired of sharing their chickens with the sly fox, seek revenge against him and his family.",2009-10-14,en,7.806,5634
364,554590,Tod@s Caen,A pair of seducers try to prove who has the best techniques while trying not to fall in love with each other.,2019-08-30,es,7.805,477
365,531,The Wrong Trousers,"Wallace rents out Gromit's former bedroom to a penguin, who takes up an interest in the techno pants created by Wallace. However, Gromit later learns that the penguin is a wanted criminal.  Preserved by the Academy Film Archive.",1993-12-17,en,7.805,1060
366,508943,Luca,Luca and his best friend Alberto experience an unforgettable summer on the Italian Riviera. But all the fun is threatened by a deeply-held secret: they are sea monsters from another world just below the water’s surface.,2021-06-17,en,7.804,8534
367,58129,The Phantom Carriage,"An alcoholic, abusive ne'er-do-well is shown the error of his ways through a legend that dooms the last person to die on New Year's Eve before the clock strikes twelve to take the reins of Death's chariot and work tirelessly collecting fresh souls for the next year.",1921-01-01,sv,7.8,326
368,301,Rio Bravo,"A small-town sheriff in the American West enlists the help of a disabled man, a drunk, and a young gunfighter in his efforts to hold in jail the brother of the local bad guy.",1959-03-18,en,7.8,1184
369,937746,Io Capitano,"Longing for a brighter future, two Senegalese teenagers embark on a journey from West Africa to Italy. However, between their dreams and reality lies a labyrinth of checkpoints, the Sahara Desert, and the vast waters of the Mediterranean.",2023-09-07,it,7.802,749
370,502,Fail Safe,Because of a technical defect an American bomber team mistakenly orders the destruction of Moscow. The President of the United States has but little time to prevent an atomic catastrophe from occurring.,1964-10-07,en,7.8,415
371,632322,All My Life,"It was a chance meeting started by one of Sol’s friends trying to chat up Jennifer. However, in the end, it was those two who hit it off. Sol enjoyed Jen’s smile, her effort, and how silly she could be. Jen enjoyed Sol’s cooking, his athleticism, and that he would join her in fun moments. As you can imagine, love bloomed, and things got serious. Jen’s investment in Sol led to her pushing him to follow his dreams and even move in to save money. Sol’s investment in Jen well, it led to him proposing. But what started as a liver tumor grew into full-on cancer, so with a diagnosis of 6 months to live, Sol and Jennifer try to make the best of it.",2020-10-23,en,7.801,497
372,762,Monty Python and the Holy Grail,"King Arthur, accompanied by his squire, recruits his Knights of the Round Table, including Sir Bedevere the Wise, Sir Lancelot the Brave, Sir Robin the Not-Quite-So-Brave-As-Sir-Lancelot and Sir Galahad the Pure. On the way, Arthur battles the Black Knight who, despite having had all his limbs chopped off, insists he can still fight. They reach Camelot, but Arthur decides not  to enter, as ""it is a silly place"".",1975-04-03,en,7.801,5983
373,674,Harry Potter and the Goblet of Fire,"When Harry Potter's name emerges from the Goblet of Fire, he becomes a competitor in a grueling battle for glory among three wizarding schools—the Triwizard Tournament. But since Harry never submitted his name for the Tournament, who did? Now Harry must confront a deadly dragon, fierce water demons and an enchanted maze only to find himself in the cruel grasp of He Who Must Not Be Named.",2005-11-16,en,7.801,21191
374,29845,A Woman Under the Influence,"Mabel Longhetti, desperate and lonely, is married to a Los Angeles municipal construction worker, Nick. Increasingly unstable, especially in the company of others, she craves happiness, but her extremely volatile behavior convinces Nick that she poses a danger to their family and decides to commit her to an institution for six months. Alone with a trio of kids to raise on his own, he awaits her return, which holds more than a few surprises.",1974-11-18,en,7.8,512
375,901563,Close,"Two 13-year-old boys spend an idyllic summer together, but their connection is put to the test when they become the subject of speculation at school.",2022-11-01,fr,7.799,869
376,799766,Better Man,"Follow Robbie Williams' journey from childhood, to being the youngest member of chart-topping boyband Take That, through to his unparalleled achievements as a record-breaking solo artist – all the while confronting the challenges that stratospheric fame and success can bring.",2024-12-06,en,7.799,509
377,11621,Porco Rosso,"In Italy in the 1930s, sky pirates in biplanes terrorize wealthy cruise ships as they sail the Adriatic Sea. The only pilot brave enough to stop the scourge is the mysterious Porco Rosso, a former World War I flying ace who was somehow turned into a pig during the war. As he prepares to battle the pirate crew's American ace, Porco Rosso enlists the help of spunky girl mechanic Fio Piccolo and his longtime friend Madame Gina.",1992-07-18,ja,7.798,3423
378,562,Die Hard,"NYPD cop John McClane's plan to reconcile with his estranged wife is thrown for a serious loop when, minutes after he arrives at her offices Christmas Party, the entire building is overtaken by a group of terrorists. With little help from the LAPD, wisecracking McClane sets out to single-handedly rescue the hostages and bring the bad guys down.",1988-07-15,en,7.799,11515
379,113,"Spring, Summer, Fall, Winter... and Spring","An isolated lake, where an old monk lives in a small floating temple. The monk has a young boy living with him, learning to become a monk. We watch as seasons and years pass by.",2003-09-19,ko,7.799,1098
380,9475,Scent of a Woman,"Charlie Simms is a student at a private preparatory school who comes from a poor family. To earn the money for his flight home to Gresham, Oregon for Christmas, Charlie takes a job over Thanksgiving looking after retired U.S. Army officer Lieutenant Colonel Frank Slade, a cantankerous middle-aged man who lives with his niece and her family.",1992-12-23,en,7.789,3578
381,1366,Rocky,An uneducated collector for a Philadelphia loan shark is given a once-in-a-lifetime opportunity to fight against the world heavyweight boxing champion.,1976-11-20,en,7.8,8091
382,348892,Bajrangi Bhaijaan,A young mute girl from Pakistan loses herself in India with no way to head back. A devoted man with a magnanimous spirit undertakes the task to get her back to her motherland and unite her with her family.,2015-07-17,hi,7.8,496
