,id,title,overview,release_date,original_language,vote_average,vote_count
149,437068,A Taxi Driver,"May, 1980. Man-seob is a taxi driver in Seoul who lives from hand to mouth, raising his young daughter alone. One day, he hears that there is a foreigner who will pay big money for a drive down to Gwangju city. Not knowing that he’s a German journalist with a hidden agenda, Man-seob takes the job.",2017-08-02,ko,8.063,1047
150,1064486,Memoir of a Snail,"Forcibly separated from her twin brother when they are orphaned, a melancholic misfit learns how to find confidence within herself amid the clutter of misfortunes and everyday life.",2024-10-17,en,8.062,520
151,400608,Bo Burnham: Make Happy,"Combining his trademark wit and self-deprecating humor with original music, Bo Burnham offers up his unique twist on life in this stand-up special about  life, death, sexuality, hypocrisy, mental illness and Pringles cans.",2016-06-03,en,8.1,395
152,555604,Guillermo del Toro's Pinocchio,"During the rise of fascism in Mussolini's Italy, a wooden boy brought magically to life struggles to live up to his father's expectations.",2022-11-09,en,8.06,3060
153,21634,Prayers for Bobby,"Bobby Griffith was his mother's favorite son, the perfect all-American boy growing up under deeply religious influences in Walnut Creek, California. Bobby was also gay. Struggling with a conflict no one knew of, much less understood, Bobby finally came out to his family.",2009-01-24,en,8.06,598
154,548,Rashomon,"Brimming with action while incisively examining the nature of truth, ""Rashomon"" is perhaps the finest film ever to investigate the philosophy of justice. Through an ingenious use of camera and flashbacks, Kurosawa reveals the complexities of human nature as four people recount different versions of the story of a man's murder and the rape of his wife.",1950-08-26,ja,8.1,2315
155,872585,Oppenheimer,The story of J. Robert Oppenheimer's role in the development of the atomic bomb during World War II.,2023-07-19,en,8.057,10275
156,550776,Believe Me: The Abduction of Lisa McVey,"On the night she plans on taking her own life, 17-year-old 'Lisa McVey' is kidnapped and finds herself fighting to stay alive and manages to be a victim of rape. She manages to talk her attacker into releasing her, but when she returns home, no one believes her story except for one detective, who suspects she was abducted by a serial killer. Based on horrifying true events.",2018-09-30,en,8.057,640
157,11423,Memories of Murder,"During the late 1980s, two detectives in a South Korean province attempt to solve the nation's first series of rape-and-murder cases.",2003-04-25,ko,8.057,4047
158,522518,A Dog's Journey,A dog finds the meaning of his own existence through the lives of the humans he meets.,2019-05-03,en,8.055,1551
159,381284,Hidden Figures,"The untold story of Katherine G. Johnson, Dorothy Vaughan and Mary Jackson – brilliant African-American women working at NASA and serving as the brains behind one of the greatest operations in history – the launch of astronaut John Glenn into orbit. The visionary trio crossed all gender and race lines to inspire generations to dream big.",2016-12-10,en,8.055,9959
160,42229,A Special Day,Two neighbours — a persecuted journalist and a resigned housewife — forge a strong bond on the day of Adolf Hitler's historic 1938 visit to Rome.,1977-08-11,it,8.049,696
161,7347,Elite Squad,"In 1997, before the visit of the pope to Rio de Janeiro, Captain Nascimento from BOPE (Special Police Operations Battalion) is assigned to eliminate the risks of the drug dealers in a dangerous slum nearby where the pope intends to be lodged.",2007-10-12,pt,8.054,2506
162,11645,Ran,"With Ran, legendary director Akira Kurosawa reimagines Shakespeare's King Lear as a singular historical epic set in sixteenth-century Japan. Majestic in scope, the film is Kurosawa's late-life masterpiece, a profound examination of the folly of war and the crumbling of one family under the weight of betrayal, greed, and the insatiable thirst for power.",1985-06-01,ja,8.052,1624
163,1955,The Elephant Man,"A Victorian surgeon rescues a heavily disfigured man being mistreated by his ""owner"" as a side-show freak. Behind his monstrous façade, there is revealed a person of great intelligence and sensitivity. Based on the true story of Joseph Merrick (called John Merrick in the film), a severely deformed man in 19th century London.",1980-10-09,en,8.1,3655
164,992,Sherlock Jr.,"A film projectionist longs to be a detective, and puts his meagre skills to work when he is framed by a rival for stealing his girlfriend's father's pocketwatch.",1924-04-17,en,8.1,1044
165,800,The Young and the Damned,"A group of juvenile delinquents live a violent life in the infamous slums of Mexico City; among them Pedro, whose morality is gradually corrupted and destroyed by the others.",1950-12-09,es,8.0,497
166,334543,Lion,"A five-year-old Indian boy gets lost on the streets of Calcutta, thousands of kilometers from home. He survives many challenges before being adopted by a couple in Australia; 25 years later, he sets out to find his lost family.",2016-11-24,en,8.044,6704
167,640344,Me Against You: Mr. S's Vendetta,"A young couple who makes popular YouTube videos for children sets out to win an award, but an evil mastermind stands in the way of their success.",2020-01-17,it,8.0,469
168,472454,Ayla: The Daughter of War,"In 1950, amidst the ravages of the Korean War, Sergeant Süleyman stumbles upon a a half-frozen little girl, with no parents and no help in sight and he risks his own life to save her, smuggling her into his army base and out of harm’s way.",2017-10-27,tr,8.041,370
169,120467,The Grand Budapest Hotel,"The Grand Budapest Hotel tells of a legendary concierge at a famous European hotel between the wars and his friendship with a young employee who becomes his trusted protégé. The story involves the theft and recovery of a priceless Renaissance painting, the battle for an enormous family fortune and the slow and then sudden upheavals that transformed Europe during the first half of the 20th century.",2014-02-26,en,8.039,15200
170,310569,The Second Mother,"After leaving her daughter Jessica in a small town in Pernambuco to be raised by relatives, Val spends the next 13 years working as a nanny to Fabinho in São Paulo. She has financial stability but has to live with the guilt of having not raised Jessica herself. As Fabinho’s university entrance exams approach, Jessica reappears in her life and seems to want to give her mother a second chance. However, Jessica has not been raised to be a servant and her very existence will turn Val’s routine on its head. With precision and humour, the subtle and powerful forces that keep rigid class structures in place and how the youth may just be the ones to shake it all up.",2015-06-04,pt,8.036,740
171,26022,My Name Is Khan,"Rizwan Khan, a Muslim from the Borivali section of Mumbai, has Asperger's syndrome. He marries a Hindu single mother, Mandira, in San Francisco. After 9/11, Rizwan is detained by authorities at LAX who treat him as a terrorist because of his condition and his race.",2010-02-10,hi,8.034,1348
172,785534,Paper Lives,"In the streets of Istanbul, ailing waste warehouse worker Mehmet takes a small boy under his wing and must soon confront his own traumatic childhood.",2021-03-12,tr,8.035,386
173,823754,Bo Burnham: Inside,"Stuck in COVID-19 lockdown, US comedian and musician Bo Burnham attempts to stay sane and happy by writing, shooting and performing a one-man comedy special.",2021-07-22,en,8.032,535
174,582,The Lives of Others,"In 1983 East Berlin, dedicated Stasi officer Gerd Wiesler begins spying on a famous playwright and his actress-lover Christa-Maria. Wiesler becomes unexpectedly sympathetic to the couple, and faces conflicting loyalties when his superior takes a liking to Christa-Maria.",2006-03-23,de,8.034,3810
175,538362,On My Skin,"The incredible true story behind the most controversial Italian court cases in recent years. Stefano Cucchi was arrested for a minor crime and mysteriously found dead during his detention. In one week's time, a family is changed forever.",2018-09-12,it,8.031,1860
176,106646,The Wolf of Wall Street,"A New York stockbroker refuses to cooperate in a large securities fraud case involving corruption on Wall Street, corporate banking world and mob infiltration. Based on Jordan Belfort's autobiography.",2013-12-25,en,8.029,24646
177,821,Judgment at Nuremberg,"In 1947, four German judges who served on the bench during the Nazi regime face a military tribunal to answer charges of crimes against humanity. Chief Justice Haywood hears evidence and testimony not only from lead defendant Ernst Janning and his defense attorney Hans Rolfe, but also from the widow of a Nazi general, an idealistic U.S. Army captain and reluctant witness Irene Wallner.",1961-12-18,en,8.029,844
178,838240,Robot Dreams,A lonely dog's friendship with his robot companion takes a sad turn when an unexpected malfunction forces him to abandon Robot at the beach. Will Dog ever meet Robot again?,2023-12-06,es,8.028,661
179,638507,How to Train Your Dragon: Homecoming,"It's been ten years since the dragons moved to the Hidden World, and even though Toothless doesn't live in New Berk anymore, Hiccup continues the holiday traditions he once shared with his best friend. But the Vikings of New Berk were beginning to forget about their friendship with dragons. Hiccup, Astrid, and Gobber know just what to do to keep the dragons in the villagers' hearts. And across the sea, the dragons have a plan of their own...",2019-12-03,en,8.027,1015
180,43949,Flipped,"When Juli meets Bryce in the second grade, she knows it's true love. After spending six years trying to convince Bryce the same, she's ready to give up - until he starts to reconsider.",2010-08-06,en,8.027,3128
181,9277,The Sting,A novice con man teams up with an acknowledged master to avenge the murder of a mutual friend by pulling off the ultimate big con and swindling a fortune from a big-time mobster.,1973-12-25,en,8.026,2705
182,279,Amadeus,Disciplined Italian composer Antonio Salieri becomes consumed by jealousy and resentment towards the hedonistic and remarkably talented young Viennese composer Wolfgang Amadeus Mozart.,1984-09-19,en,8.024,4406
183,147,The 400 Blows,"For young Parisian boy Antoine Doinel, life is one difficult situation after another. Surrounded by inconsiderate adults, including his neglectful parents, Antoine spends his days with his best friend, Rene, trying to plan for a better life. When one of their schemes goes awry, Antoine ends up in trouble with the law, leading to even more conflicts with unsympathetic authority figures.",1959-06-03,fr,8.0,2200
184,204,The Wages of Fear,"In a run-down South American town, four men are paid to drive trucks loaded with nitroglycerin into the jungle through to the oil field. Friendships are tested and rivalries develop as they embark upon the perilous journey.",1953-04-22,fr,8.0,986
185,8422,Rocco and His Brothers,"When a impoverished widow’s family moves to the big city, two of her five sons become romantic rivals with deadly results.",1960-10-07,it,8.02,611
186,610461,"Veinteañera, divorciada y fantástica","Regina, our young protagonist, always dreamed of getting married. And she did it - but the dream lasted much less than she thought and now she has to face life in a very funny way as a divorcee.",2020-02-14,es,8.0,388
187,938,For a Few Dollars More,"Two bounty hunters both pursue the brutal and sadistic bandit, El Indio, who has a large bounty on his head.",1965-12-18,it,8.018,4131
188,1244492,Look Back,"Popular, outgoing Fujino is celebrated by her classmates for her funny comics in the class newspaper. One day, her teacher asks her to share the space with Kyomoto, a truant recluse whose beautiful artwork sparks a competitive fervor in Fujino. What starts as jealousy transforms when Fujino realizes their shared passion for drawing.",2024-06-28,ja,8.0,355
189,347688,Scooby-Doo! and Kiss: Rock and Roll Mystery,"Get ready to Rock! Scooby-Doo and the Mystery Inc. Gang team up with the one and only KISS in this all-new, out-of-this-world adventure! We join the Gang at KISS World – the all-things-KISS theme park, as they investigate a series of strange hauntings. With help from KISS, they discover that the Crimson Witch has returned to summon The Destroyer from the alternate dimension of Kissteria! The evil duos ghastly plan, to destroy the earth! Can the Gang's cunning and KISS's power of rock save the day?!",2015-07-09,en,8.0,326
190,521,Dial M for Murder,"When American writer Mark Halliday visits the very married Margot Wendice in London, he unknowingly sets off a chain of blackmail and murder.",1954-05-29,en,8.017,2675
191,110416,Song of the Sea,"The story of the last Seal Child’s journey home. After their mother’s disappearance, Ben and Saoirse are sent to live with Granny in the city. When they resolve to return to their home by the sea, their journey becomes a race against time as they are drawn into a world Ben knows only from his mother’s folktales. But this is no bedtime story; these fairy folk have been in our world far too long. It soon becomes clear to Ben that Saoirse is the key to their survival.",2014-06-23,en,8.0,1463
192,55960,"Toto, Peppino, and the Hussy","Antonio, Peppino and Lucia are three brothers who live in the country near Naples. Lucia's son, Gianni, goes to Naples to study medicine, but there he knows a ballet dancer. They fall in love and, when she goes to Milan, Gianni follows her. Informed of this and afraid that their nephew will stop studying, the three Caponi brothers leave for Milan to persuade Gianni to come back and continue studying and abandon the ""Malafemmina"" (bad girl).",1956-08-23,it,8.0,356
193,641,Requiem for a Dream,The drug-induced utopias of four Coney Island residents are shattered when their addictions run deep.,2000-10-06,en,8.014,10292
194,307,"Rome, Open City","In WWII-era Rome, underground resistance leader Manfredi attempts to evade the Gestapo by enlisting the help of Pina, the fiancée of a fellow member of the resistance, and Don Pietro, the priest due to oversee her marriage. But it’s not long before the Nazis and the local police find him.",1945-10-08,it,8.0,909
195,962232,Beyond the Universe,"While waiting for a kidney transplant, a young pianist finds an unexpected connection with her doctor — and the courage to fulfill her musical dreams.",2022-10-27,pt,8.0,325
196,28178,Hachi: A Dog's Tale,A drama based on the true story of a college professor's bond with the abandoned dog he takes into his home.,2009-06-08,en,8.011,6829
197,673,Harry Potter and the Prisoner of Azkaban,"Year three at Hogwarts means new fun and challenges as Harry learns the delicate art of approaching a Hippogriff, transforming shape-shifting Boggarts into hilarity and even turning back time. But the term also brings danger: soul-sucking Dementors hover over the school, an ally of the accursed He-Who-Cannot-Be-Named lurks within the castle walls, and fearsome wizard Sirius Black escapes Azkaban. And Harry will confront them all.",2004-05-31,en,8.011,22120
198,20530,Late Spring,"Noriko is perfectly happy living at home with her widowed father, Shukichi, and has no plans to marry -- that is, until her aunt Masa convinces Shukichi that unless he marries off his 27-year-old daughter soon, she will likely remain alone for the rest of her life. When Noriko resists Masa's matchmaking, Shukichi is forced to deceive his daughter and sacrifice his own happiness to do what he believes is right.",1949-09-13,ja,8.009,435
199,14,American Beauty,"Lester Burnham, a depressed suburban father in a mid-life crisis, decides to turn his hectic life around after developing an infatuation with his daughter's attractive friend.",1999-09-15,en,8.008,12367
200,615457,Nobody,"Hutch Mansell, a suburban dad, overlooked husband, nothing neighbor — a ""nobody."" When two thieves break into his home one night, Hutch's unknown long-simmering rage is ignited and propels him on a brutal path that will uncover dark secrets he fought to leave behind.",2021-03-18,en,7.925,7407
201,158445,Miracle in Cell No. 7,A story about a mentally ill man wrongfully imprisoned for murder and his relationship with his 6 year old daughter.,2013-01-23,ko,7.926,453
202,234,The Cabinet of Dr. Caligari,"Francis, a young man, recalls in his memory the horrible experiences he and his fiancée Jane recently went through. Francis and his friend Alan visit The Cabinet of Dr. Caligari, an exhibit where the mysterious doctor shows the somnambulist Cesare, and awakens him for some moments from his death-like sleep.",1920-02-27,de,7.9,1642
203,916224,Suzume,"Suzume, 17, lost her mother as a little girl. On her way to school, she meets a mysterious young man. But her curiosity unleashes a calamity that endangers the entire population of Japan, and so Suzume embarks on a journey to set things right.",2022-11-11,ja,7.924,1480
204,1646,Freedom Writers,"A young teacher inspires her class of at-risk students to learn tolerance, apply themselves, and pursue education beyond high school.",2007-01-05,en,7.924,2298
205,49964,Where Is The Friend's House?,"An 8 year old boy must return his friend's notebook he took by mistake, lest his friend be punished by expulsion from school.",1987-07-01,fa,7.923,376
206,1578,Raging Bull,"The life of boxer Jake LaMotta, whose violence and temper that led him to the top in the ring destroyed his life outside of it.",1980-11-14,en,7.923,4446
207,85,Raiders of the Lost Ark,"When Dr. Indiana Jones – the tweed-suited professor who just happens to be a celebrated archaeologist – is hired by the government to locate the legendary Ark of the Covenant, he finds himself up against the entire Nazi regime.",1981-06-12,en,7.922,12868
208,152532,Dallas Buyers Club,"Loosely based on the true-life tale of Ron Woodroof, a drug-taking, women-loving, homophobic man who in 1986 was diagnosed with HIV/AIDS and given thirty days to live.",2013-11-01,en,7.92,8641
209,949,Heat,Obsessive master thief Neil McCauley leads a top-notch crew on various daring heists throughout Los Angeles while determined detective Vincent Hanna pursues him without rest. Each man recognizes and respects the ability and the dedication of the other even though they are aware their cat-and-mouse game may end in violence.,1995-12-15,en,7.92,7621
210,3777,Throne of Blood,"Returning to their lord's castle, samurai warriors Washizu and Miki are waylaid by a spirit who predicts their futures. When the first part of the spirit's prophecy comes true, Washizu's scheming wife, Asaji, presses him to speed up the rest of the spirit's prophecy by murdering his lord and usurping his place. Director Akira Kurosawa's resetting of William Shakespeare's ""Macbeth"" in feudal Japan is one of his most acclaimed films.",1957-01-15,ja,7.9,896
211,776503,CODA,"As a CODA (Child of Deaf Adults), Ruby is the only hearing person in her deaf family. When the family's fishing business is threatened, Ruby finds herself torn between pursuing her love of music and her fear of abandoning her parents.",2021-08-13,en,7.916,2342
212,13398,Tokyo Godfathers,"On Christmas Eve, three homeless people living on the streets of Tokyo discover a newborn baby among the trash and set out to find its parents.",2003-12-05,ja,7.916,1351
213,829,Chinatown,"Private eye Jake Gittes lives off of the murky moral climate of sunbaked, pre-World War II Southern California. Hired by a beautiful socialite to investigate her husband's extra-marital affair, Gittes is swept into a maelstrom of double dealings and deadly deceits, uncovering a web of personal and political scandals that come crashing together.",1974-06-20,en,7.915,3953
214,827,Diabolique,"The cruel and abusive headmaster of a boarding school, Michel Delassalle, is murdered by an unlikely duo -- his meek wife and the mistress he brazenly flaunts. The women become increasingly unhinged by a series of odd occurrences after Delassalle's corpse mysteriously disappears.",1955-01-29,fr,7.9,1012
215,122906,About Time,"The night after another unsatisfactory New Year's party, Tim's father tells his son that the men in his family have always had the ability to travel through time. They can't change history, but they can change what happens and has happened in their own lives. Thus begins the start of a lesson in learning to appreciate life itself as it is, as it comes, and most importantly, the people living alongside us.",2013-09-04,en,7.914,8758
216,51482,Death Note Relight 1: Visions of a God,"A recap of Death Note episodes 1–26, with new footage. When rogue shinigami Ryuk leaves his Death Note in the human world, he has no idea how far the one who finds it will take his new-found power. With the Death Note in hand, brilliant high school student Light Yagami vows to rid the world of evil.",2009-09-23,ja,7.9,359
217,489412,It's Such a Beautiful Day,Bill struggles to put together his shattered psyche.,2012-08-24,en,7.913,341
218,426618,Where Hands Touch,"Germany, 1944. Leyna, the 15-year old daughter of a white German mother and a black African father, meets Lutz, a compassionate member of the Hitler Youth whose father is a prominent Nazi soldier, and they form an unlikely connection in this quickly changing world.",2018-09-14,en,7.913,520
219,1092,The Third Man,"In postwar Vienna, Austria, Holly Martins, a writer of pulp Westerns, arrives penniless as a guest of his childhood chum Harry Lime, only to learn he has died. Martins develops a conspiracy theory after learning of a ""third man"" present at the time of Harry's death, running into interference from British officer Major Calloway, and falling head-over-heels for Harry's grief-stricken lover, Anna.",1949-08-31,en,7.9,1946
220,405,La Strada,"When Gelsomina, a naïve young woman, is purchased from her impoverished mother by brutish circus strongman Zampanò to be his wife and partner, she loyally endures her husband's coldness and abuse as they travel the Italian countryside performing together. Soon Zampanò must deal with his jealousy and conflicted feelings about Gelsomina when she finds a kindred spirit in Il Matto, the carefree circus fool, and contemplates leaving Zampanò.",1954-09-23,it,7.903,1090
221,491480,The Boy Who Harnessed the Wind,"Against all the odds, a thirteen year old boy in Malawi invents an unconventional way to save his family and village from famine.",2019-02-14,en,7.902,1723
222,7984,In the Name of the Father,"A small-time Belfast thief, Gerry Conlon, is wrongly convicted of an IRA bombing in London, along with his father and friends, and spends 15 years in prison fighting to prove his innocence.",1993-12-12,en,7.9,1808
223,1892,Return of the Jedi,"Luke Skywalker leads a mission to rescue his friend Han Solo from the clutches of Jabba the Hutt, while the Emperor seeks to destroy the Rebellion once and for all with a second dreaded Death Star.",1983-05-25,en,7.902,16082
224,671,Harry Potter and the Philosopher's Stone,"Harry Potter has lived under the stairs at his aunt and uncle's house his whole life. But on his 11th birthday, he learns he's a powerful wizard—with a place waiting for him at the Hogwarts School of Witchcraft and Wizardry. As he learns to harness his newfound powers with the help of the school's kindly headmaster, Harry uncovers the truth about his parents' deaths—and about the villain who's to blame.",2001-11-16,en,7.902,28236
225,488623,Forgotten,"Seoul, South Korea, 1997. When the young but extremely anxious student Jin-seok, his parents and his successful older brother Yoo-seok move to a new home, mysterious and frightening events begin to happen around them, unexplained events that threaten to ruin their seemingly happy lives. Unable to understand what is happening, Jin-seok wonders if he is losing his mind.",2017-11-29,ko,7.9,1177
226,20722,La Maison en Petits Cubes,La Maison en Petits Cubes tells the story of a grandfather's memories as he adds more blocks to his house to stem the flooding waters.,2008-06-10,ja,7.901,434
227,505262,My Hero Academia: Two Heroes,"All Might and Deku accept an invitation to go abroad to a floating and mobile manmade city, called 'I-Island', where they research quirks as well as hero supplemental items at the special 'I-Expo' convention that is currently being held on the island. During that time, suddenly, despite an iron wall of security surrounding the island, the system is breached by a villain, and the only ones able to stop him are the students of Class 1-A.",2018-08-03,ja,7.9,1038
228,313369,La La Land,"Mia, an aspiring actress, serves lattes to movie stars in between auditions and Sebastian, a jazz musician, scrapes by playing cocktail party gigs in dingy bars, but as success mounts they are faced with decisions that begin to fray the fragile fabric of their love affair, and the dreams they worked so hard to maintain in each other threaten to rip them apart.",2016-12-01,en,7.9,17292
229,29455,Winter Light,"A Swedish pastor fails a loving woman, a suicidal fisherman and God.",1963-02-11,sv,7.899,463
230,752,V for Vendetta,"In a world in which Great Britain has become a fascist state, a masked vigilante known only as “V” conducts guerrilla warfare against the oppressive British government. When V rescues a young woman from the secret police, he finds in her an ally with whom he can continue his fight to free the people of Britain.",2006-02-23,en,7.899,14818
231,654,On the Waterfront,"Terry Malloy is a kindhearted dockworker, and former boxer, who is tricked by his corrupt bosses into leading his friend to death. After falling in love, he tries to leave the waterfront and expose his employers.",1954-06-22,en,7.9,1634
