,id,title,overview,release_date,original_language,vote_average,vote_count
383,277216,Straight Outta Compton,"In 1987, five young men, using brutally honest rhymes and hardcore beats, put their frustration and anger about life in the most dangerous place in America into the most powerful weapon they had: their music.  Taking us back to where it all began, Straight Outta Compton tells the true story of how these cultural rebels—armed only with their lyrics, swagger, bravado and raw talent—stood up to the authorities that meant to keep them down and formed the world’s most dangerous group, N.W.A.  And as they spoke the truth that no one had before and exposed life in the hood, their voice ignited a social revolution that is still reverberating today.",2015-08-11,en,7.788,3987
384,887,The Best Years of Our Lives,"It's the hope that sustains the spirit of every GI: the dream of the day when he will finally return home. For three WWII veterans, the day has arrived. But for each man, the dream is about to become a nightmare.",1946-12-25,en,7.788,674
385,359156,Don't Be Bad,"A story set in the 90s and in the outskirts of Rome to Ostia. A world where money, luxury cars, night clubs, cocaine and synthetic drugs are easy to run. A world in which Vittorio and Cesare, in their early twenties, act in search of their success.",2015-09-08,it,7.787,987
386,149870,The Wind Rises,"A lifelong love of flight inspires Japanese aviation engineer Jiro Horikoshi, whose storied career includes the creation of the A-6M World War II fighter plane.",2013-07-20,ja,7.8,3122
387,49026,The Dark Knight Rises,"Following the death of District Attorney Harvey Dent, Batman assumes responsibility for Dent's crimes to protect the late attorney's reputation and is subsequently hunted by the Gotham City Police Department. Eight years later, Batman encounters the mysterious Selina Kyle and the villainous Bane, a new terrorist leader who overwhelms Gotham's finest. The Dark Knight resurfaces to protect a city that has branded him an enemy.",2012-07-17,en,7.785,23228
388,31056,A Short Film About Love,"19-year-old Tomek whiles away his lonely life by spying on his opposite neighbour Magda through binoculars. She's an artist in her mid-thirties, and appears to have everything - not least a constant stream of men at her beck and call. But when the two finally meet, they discover that they have a lot more in common than appeared at first sight...",1988-08-21,pl,7.785,379
389,13042,Presto,"Dignity. Poise. Mystery. We expect nothing less from the great turn-of-the-century magician, Presto. But when Presto neglects to feed his rabbit one too many times, the magician finds he isn't the only one with a few tricks up his sleeve!",2008-06-27,en,7.785,1015
390,142,Brokeback Mountain,"In 1960s Wyoming, two men develop a strong emotional and sexual relationship that endures as a lifelong connection complicating their lives as they get married and start families of their own.",2005-10-22,en,7.785,7162
391,5991,The Last Laugh,"An aging doorman, after being fired from his prestigious job at a luxurious hotel is forced to face the scorn of his friends, neighbours and society.",1924-12-23,de,7.783,314
392,438631,Dune,"Paul Atreides, a brilliant and gifted young man born into a great destiny beyond his understanding, must travel to the most dangerous planet in the universe to ensure the future of his family and his people. As malevolent forces explode into conflict over the planet's exclusive supply of the most precious resource in existence-a commodity capable of unlocking humanity's greatest potential-only those who can conquer their fear will survive.",2021-09-15,en,7.782,13573
393,71157,Polisse,"Paris, France. Fred and his colleagues, members of the BPM, the Police Child Protection Unit, dedicated to pursuing all sorts of offenses committed against the weakest, must endure the scrutiny of Melissa, a photographer commissioned to graphically document the daily routine of the team.",2011-10-06,fr,7.782,1248
394,14069,The Girl Who Leapt Through Time,"When 17-year-old Makoto Konno gains the ability to, quite literally, ""leap"" backwards through time, she immediately sets about improving her grades and preventing personal mishaps. However, she soon realises that changing the past isn't as simple as it seems, and eventually, will have to rely on her new powers to shape the future of herself and her friends.",2006-07-15,ja,7.781,2079
395,2721,Z,"Amid a tense political climate, the opposition leader is killed in an apparent accident. When a prosecutor smells a cover-up, witnesses get targeted. A thinly veiled dramatization of the assassination of Greek politician Grigoris Lambrakis and its aftermath, “Z” captures the outrage at the US-backed junta that ruled Greece at the time of its release.",1969-02-26,fr,7.78,564
396,523781,Words on Bathroom Walls,"Diagnosed with a mental illness halfway through his senior year of high school, a witty, introspective teen struggles to keep it a secret while falling in love with a brilliant classmate who inspires him to open his heart and not be defined by his condition.",2020-08-21,en,7.779,626
397,934,Rififi,"Out of prison after a five-year stretch, jewel thief Tony turns down a quick job his friend Jo offers him, until he discovers that his old girlfriend Mado has become the lover of local gangster Pierre Grutter during Tony's absence. Expanding a minor smash-and-grab into a full-scale jewel heist, Tony and his crew appear to get away clean, but their actions after the job is completed threaten the lives of everyone involved.",1955-04-13,fr,7.8,581
398,262,The King of Comedy,"Aspiring comic Rupert Pupkin attempts to achieve success in show business by stalking his idol, a late night talk-show host who craves his own privacy.",1982-12-18,en,7.778,2384
399,5000,Forbidden Games,"Orphaned after a Nazi air raid, Paulette, a young Parisian girl, runs into Michel, an older peasant boy, and the two quickly become close. Together, they try to make sense of the chaotic and crumbling world around them, attempting to cope with death as they create a burial ground for Paulette's deceased pet dog. Eventually, however, Paulette's stay with Michel's family is threatened by the harsh realities of wartime.",1952-05-09,fr,7.777,319
400,11005,Awakenings,"Dr. Malcolm Sayer, a shy research physician, uses an experimental drug to ""awaken"" the catatonic victims of a rare disease. Leonard is the first patient to receive the controversial treatment. His awakening, filled with awe and enthusiasm, proves a rebirth for Sayer too, as the exuberant patient reveals life's simple but unutterably sweet pleasures to the introverted doctor.",1990-12-04,en,7.8,2637
401,5961,Fanny and Alexander,"As children in the loving Ekdahl family, Fanny and Alexander enjoy a happy life with their parents, who run a theater company. After their father dies unexpectedly, however, the siblings end up in a joyless home when their mother, Emilie, marries a stern bishop. The bleak situation gradually grows worse as the bishop becomes more controlling, but dedicated relatives make a valiant attempt to aid Emilie, Fanny and Alexander.",1982-12-17,sv,7.8,801
402,715931,Emancipation,"Inspired by the gripping true story of a man who would do anything for his family—and for freedom. When Peter, an enslaved man, risks his life to escape and return to his family, he embarks on a perilous journey of love and endurance.",2022-12-02,en,7.8,1167
403,585511,Luck,"Suddenly finding herself in the never-before-seen Land of Luck, the unluckiest person in the world must unite with the magical creatures there to turn her luck around.",2022-08-05,en,7.772,1801
404,9421,The Dinner Game,"For Pierre Brochant and his friends, Wednesday is “Idiots' Day”. The idea is simple: each person has to bring along an idiot. The one who brings the most spectacular idiot wins the prize. Tonight, Brochant is ecstatic. He has found a gem. The ultimate idiot, “A world champion idiot!”. What Brochant doesn’t know is that Pignon is a real jinx, a past master in the art of bringing on catastrophes...",1998-04-15,fr,7.772,1953
405,6844,The Ten Commandments,"Escaping death, a Hebrew infant is raised in a royal household to become a prince. Upon discovery of his true heritage, Moses embarks on a personal quest to reclaim his destiny as the leader and liberator of the Hebrew people.",1956-10-05,en,7.8,1702
406,1675,Day for Night,"A committed film director struggles to complete his movie while coping with a myriad of crises, personal and professional, among the cast and crew.",1973-05-24,fr,7.772,608
407,165,Back to the Future Part II,"Marty and Doc are at it again as the time-traveling duo head to 2015 to nip some McFly family woes in the bud. But things go awry thanks to bully Biff Tannen and a pesky sports almanac. In a last-ditch attempt to set things straight, Marty finds himself bound for 1955 and face to face with his teenage parents -- again.",1989-11-22,en,7.772,13152
408,428493,God's Own Country,"A young farmer in rural Yorkshire numbs his daily frustrations with binge drinking and casual sex, until the arrival of a Romanian migrant worker.",2017-08-31,en,7.771,927
409,144,Wings of Desire,"Two angels, Damiel and Cassiel, glide through the streets of Berlin, observing the bustling population, providing invisible rays of hope to the distressed but never interacting with them. When Damiel falls in love with lonely trapeze artist Marion, the angel longs to experience life in the physical world, and finds -- with some words of wisdom from actor Peter Falk -- that it might be possible for him to take human form.",1987-09-23,de,7.771,1375
410,141,Donnie Darko,"After narrowly escaping a bizarre accident, a troubled teenager is plagued by visions of a large bunny rabbit that manipulates him to commit a series of crimes.",2001-01-19,en,7.771,12750
411,712454,The Summit of the Gods,A photojournalist's obsessive quest for the truth about the first expedition to Mt. Everest leads him to search for an esteemed climber who went missing.,2021-09-22,fr,7.8,371
412,423612,Never Look Away,"German artist Kurt Barnert has escaped East Germany and now lives in West Germany, but is tormented by his childhood under the Nazis and the GDR regime.",2018-10-03,de,7.8,697
413,25050,Still Walking,A family gathers together for a commemorative ritual whose nature only gradually becomes clear.,2008-06-28,ja,7.8,389
414,12496,The Twilight Samurai,"Seibei Iguchi leads a difficult life as a low ranking samurai at the turn of the nineteenth century. A widower with a meager income, Seibei struggles to take care of his two daughters and senile mother. New prospects seem to open up when the beautiful Tomoe, a childhood friend, comes back into he and his daughters' life, but as the Japanese feudal system unravels, Seibei is still bound by the code of honor of the samurai and by his own sense of social precedence. How can he find a way to do what is best for those he loves?",2002-11-02,ja,7.767,324
415,553,Dogville,"When beautiful young Grace arrives in the isolated township of Dogville, the small community agrees to hide her from a gang of ruthless gangsters, and, in return, Grace agrees to do odd jobs for the townspeople.",2003-05-21,en,7.8,2492
416,169813,Short Term 12,"Grace, a compassionate young supervisor at a foster care facility, helps at-risk teens. But when a new charge dredges up memories of her own troubled past, Grace's tough exterior begins eroding.",2013-08-23,en,7.765,1324
417,22504,The King and the Mockingbird,"A young shepherdess and a chimneysweep plan to get married and escape the clutches of a tyrannical king in love with her, assisted by the guile of a cheeky mockingbird, the king's archenemy.",1980-03-19,fr,7.765,381
418,18079,Nine Queens,"Two con artists try to swindle a stamp collector by selling him a sheet of counterfeit rare stamps (the ""nine queens"").",2000-08-31,es,7.765,737
419,126319,Ernest & Celestine,"Celestine is a little mouse trying to avoid a dental career while Ernest is a big bear craving an artistic outlet. When Celestine meets Ernest, they overcome their natural enmity by forging a life of crime together.",2012-12-12,fr,7.764,624
420,269149,Zootopia,"Determined to prove herself, Officer Judy Hopps, the first bunny on Zootopia's police force, jumps at the chance to crack her first case - even if it means partnering with scam-artist fox Nick Wilde to solve the mystery.",2016-02-11,en,7.747,16699
421,1700,Misery,"After an accident, acclaimed novelist Paul Sheldon is rescued by a nurse who claims to be his biggest fan.  Her obsession takes a dark turn when she holds him captive in her remote Colorado home and forces him to write back to life the popular literary character he killed off.",1990-11-30,en,7.747,4825
422,12429,Ponyo,"When Sosuke, a young boy who lives on a clifftop overlooking the sea, rescues a stranded goldfish named Ponyo, he discovers more than he bargained for. Ponyo is a curious, energetic young creature who yearns to be human, but even as she causes chaos around the house, her father, a powerful sorcerer, schemes to return Ponyo to the sea.",2008-07-19,ja,7.7,4446
423,203217,My Mom Is a Character,"After another spat with her kids, Dona Hermínia decides to take some time off from them and hides away in her aunt's house, where she reminisces about her kids in an age when they still needed her.",2013-06-21,pt,7.745,662
424,322,Mystic River,The lives of three men who were childhood friends are shattered when one of them suffers a family tragedy.,2003-10-07,en,7.745,6907
425,20126,Deep Red,"An English pianist living in Rome witnesses the brutal murder of his psychic neighbor. With the help of a tenacious young reporter, he tries to discover the killer using very unconventional methods. The two are soon drawn into a shocking web of dementia and violence.",1975-03-07,it,7.7,1498
426,211954,Instructions Not Included,"Valentin is Acapulco's resident playboy, until a former fling leaves a baby on his doorstep and him heading with her out of Mexico.",2013-07-20,es,7.7,905
427,40662,Batman: Under the Red Hood,"One part vigilante, one part criminal kingpin, Red Hood begins cleaning up Gotham with the efficiency of Batman, but without following the same ethical code.",2010-07-27,en,7.743,1634
428,336804,Mustang,"In a Turkish village, five orphaned sisters live under strict rule while members of their family prepare their arranged marriages.",2015-06-17,tr,7.742,1393
429,25253,Crooks in Clover,"An aging gangster, Fernand Naudin is hoping for a quiet retirement when he suddenly inherits a fortune from an old friend, a former gangster supremo known as the Mexican. If he is ambivalent about his new found wealth, Fernand is positively nonplussed to discover that he has also inherited his benefactor’s daughter, Patricia. Unfortunately, not only does Fernand have to put up with the thoroughly modern Patricia and her nauseating boyfriend, but he also had to contend with the Mexican’s trigger-happy former employees, who are determined to make a claim.",1963-11-27,fr,7.742,517
430,14282,Ninja Scroll,"Jubei is a masterless ninja who travels the land alone, lending his services to those with gold—or a worthy cause. His fearsome abilities have served him well, but a plot to overthrow the government threatens to end his wandering ways—and possibly his life.",1993-06-05,ja,7.734,662
431,792,Platoon,"As a young and naive recruit in Vietnam, Chris Taylor faces a moral crisis when confronted with the horrors of war and the duality of man.",1986-12-19,en,7.742,4710
432,666277,Past Lives,"After decades apart, childhood friends Nora and Hae Sung are reunited in New York for one fateful weekend as they confront notions of destiny, love, and the choices that make a life.",2023-06-02,en,7.741,1922
433,12444,Harry Potter and the Deathly Hallows: Part 1,"Harry, Ron and Hermione walk away from their last year at Hogwarts to find and destroy the remaining Horcruxes, putting an end to Voldemort's bid for immortality. But with Harry's beloved Dumbledore dead and Voldemort's unscrupulous Death Eaters on the loose, the world is more dangerous than ever.",2010-11-17,en,7.741,19501
434,705861,Hustle,"After discovering a once-in-a-lifetime player with a rocky past abroad, a down on his luck basketball scout takes it upon himself to bring the phenom to the States without his team's approval. Against the odds, they have one final shot to prove they have what it takes to make it in the NBA.",2022-06-03,en,7.74,2632
435,15265,The Red Balloon,"A young boy discovers a stray balloon, which seems to have a mind of its own, on the streets of Paris. The two become inseparable, yet the world’s harsh realities finally interfere.",1956-08-24,fr,7.738,406
436,1040,The Leopard,"As Garibaldi's troops begin the unification of Italy in the 1860s, an aristocratic Sicilian family grudgingly adapts to the sweeping social changes undermining their way of life. Proud but pragmatic Prince Don Fabrizio Salina allows his war hero nephew, Tancredi, to marry Angelica, the beautiful daughter of gauche, bourgeois Don Calogero, in order to maintain the family's accustomed level of comfort and political clout.",1963-03-27,it,7.739,861
437,703,Annie Hall,New York comedian Alvy Singer falls in love with the ditsy Annie Hall.,1977-04-19,en,7.739,3993
438,143,All Quiet on the Western Front,"When a group of idealistic young men join the German Army during the Great War, they are assigned to the Western Front, where their patriotism is destroyed by the harsh realities of combat.",1930-04-29,en,7.7,836
439,382591,Two Is a Family,A man without attachments or responsibilities suddenly finds himself with an abandoned baby and leaves for London to try and find the mother. Eight years later after he and his daughter become inseparable Gloria's mother reappears.,2016-12-07,fr,7.738,2997
440,11902,Underground,"A group of Serbian socialists prepares for the war in a surreal underground filled by parties, tragedies, love and hate.",1995-05-13,sr,7.7,699
441,123025,"Batman: The Dark Knight Returns, Part 1","Batman has not been seen for ten years. A new breed of criminal ravages Gotham City, forcing 55-year-old Bruce Wayne back into the cape and cowl. But, does he still have what it takes to fight crime in a new era?",2012-08-21,en,7.736,1634
442,369299,Don't Blame the Kid,"After a one-night stand results in pregnancy, a young woman decides to become partners with the emotionally immature father-to-be.",2016-05-13,es,7.735,648
443,21135,L'Eclisse,"This romantic drama by Michelangelo Antonioni follows the love life of Vittoria, a beautiful literary translator living in Rome. After splitting from her writer boyfriend, Riccardo, Vittoria meets Piero, a lively stockbroker, on the hectic floor of the Roman stock exchange. Though Vittoria and Piero begin a relationship, it is not one without difficulties, and their commitment to one another is tested during an eclipse.",1962-04-13,it,7.735,501
444,2108,The Breakfast Club,"Five high school students from different walks of life endure a Saturday detention under a power-hungry principal. The disparate group includes rebel John, princess Claire, outcast Allison, brainy Brian and Andrew, the jock. Each has a chance to tell his or her story, making the others see them a little differently -- and when the day ends, they question whether school will ever be the same.",1985-02-15,en,7.734,8152
445,492188,Marriage Story,"A stage director and an actress struggle through a grueling, coast-to-coast divorce that pushes them to their personal extremes.",2019-09-28,en,7.7,7085
446,45269,The King's Speech,"The King's Speech tells the story of the man who became King George VI, the father of Queen Elizabeth II. After his brother abdicates, George ('Bertie') reluctantly assumes the throne. Plagued by a dreaded stutter and considered unfit to be king, Bertie engages the help of an unorthodox speech therapist named Lionel Logue. Through a set of unexpected techniques, and as a result of an unlikely friendship, Bertie is able to find his voice and boldly lead the country into war.",2010-11-26,en,7.733,8885
447,980026,The Promised Land,"Denmark, 1755. Captain Ludvig Kahlen sets out to conquer a Danish heath reputed to be uncultivable, with an impossible goal: to establish a colony in the name of the king, in exchange for a royal title. A single-minded ambition that the ruthless lord of the region will relentlessly seek to put down. Kahlen's fate hangs in the balance: will his endevours bring him wealth and honour, or cost him his life...?",2023-10-05,da,7.731,418
448,9552,The Exorcist,"When a charming 12-year-old girl takes on the characteristics and voices of others, doctors say there is nothing they can do. As people begin to die, the girl's mother realizes her daughter has been possessed by the Devil. Her daughter's only possible hope lies with two priests and the ancient rite of demonic exorcism.",1973-12-26,en,7.732,8164
449,12405,Slumdog Millionaire,"A teenager reflects on his life after being accused of cheating on the Indian version of ""Who Wants to be a Millionaire?"".",2008-11-12,en,7.731,10776
450,10020,Beauty and the Beast,"Follow the adventures of Belle, a bright young woman who finds herself in the castle of a prince who's been turned into a mysterious beast. With the help of the castle's enchanted staff, Belle soon learns the most important lesson of all -- that true beauty comes from within.",1991-10-22,en,7.731,10153
451,602063,Rurouni Kenshin: The Final,"In 1879, Kenshin and his allies face their strongest enemy yet: his former brother-in-law Enishi Yukishiro and his minions, who've vowed their revenge.",2021-04-23,ja,7.7,501
452,177572,Big Hero 6,"A special bond develops between plus-sized inflatable robot Baymax, and prodigy Hiro Hamada, who team up with a group of friends to form a band of high-tech heroes.",2014-10-24,en,7.7,15900
453,15121,The Sound of Music,"In the years before the Second World War, a tomboyish postulant at an Austrian abbey is hired as a governess in the home of a widowed naval captain with seven children, and brings a new love of life and music into the home.",1965-03-02,en,7.7,3375
454,5528,The Chorus,"In 1940s France, a new teacher at a school for disruptive boys gives hope and inspiration.",2004-03-17,fr,7.7,2469
455,49687,Marriage Italian Style,"During the bombing of Naples in World War II, a cynical businessman helps a naive prostitute, who spends the next two decades desperate to have him reciprocate her feelings.",1964-12-18,it,7.7,519
456,16052,Selena,"In this biographical drama, Selena Quintanilla is born into a musical Mexican-American family in Texas. Her father, Abraham, realizes that his young daughter is talented and begins performing with her at small venues. She finds success and falls for her guitarist, Chris Perez, who draws the ire of her father. Seeking mainstream stardom, Selena begins recording an English-language album which, tragically, she would never complete.",1997-03-21,en,7.727,1246
457,843906,Straight Outta Nowhere: Scooby-Doo! Meets Courage the Cowardly Dog,"With Mystery, Inc. on the tail of a strange object in Nowhere, Kansas, the strange hometown of Eustice, Muriel, and Courage, the gang soon find themselves contending with a giant cicada monster and her winged warriors.",2021-09-14,en,7.726,390
458,49046,All Quiet on the Western Front,"Paul Baumer and his friends Albert and Muller, egged on by romantic dreams of heroism, voluntarily enlist in the German army. Full of excitement and patriotic fervour, the boys enthusiastically march into a war they believe in. But once on the Western Front, they discover the soul-destroying horror of World War I.",2022-10-07,de,7.726,4181
459,903,Cool Hand Luke,"When petty criminal Luke Jackson is sentenced to two years in a Florida prison farm, he doesn't play by the rules of either the sadistic warden or the yard's resident heavy, Dragline, who ends up admiring the new guy's unbreakable will. Luke's bravado, even in the face of repeated stints in the prison's dreaded solitary confinement cell, ""the box,"" make him a rebel hero to his fellow convicts and a thorn in the side of the prison officers.",1967-11-01,en,7.726,1478
460,486589,Red Shoes and the Seven Dwarfs,"Princes who have been turned into Dwarfs seek the red shoes of a lady in order to break the spell, although it will not be easy.",2019-07-25,en,7.7,1098
461,1626,Vivre Sa Vie,Twelve episodic tales in the life of a Parisian woman and her slow descent into prostitution.,1962-09-20,fr,7.725,662
462,309,The Celebration,"The family of a wealthy businessman gather to celebrate his 60th birthday. During the course of the party, his eldest son presents a speech that reveals a shocking secret.",1998-06-19,da,7.725,1137
463,603692,John Wick: Chapter 4,"With the price on his head ever increasing, John Wick uncovers a path to defeating The High Table. But before he can earn his freedom, Wick must face off against a new enemy with powerful alliances across the globe and forces that turn old friends into foes.",2023-03-22,en,7.723,7081
464,61979,Three Steps Above Heaven,"Story of two young people who belong to different worlds. It is the chronicle of a love improbable, almost impossible but inevitable dragging in a frantic journey they discover the first great love. Babi is a girl from upper-middle class that is educated in goodness and innocence . Hache is a rebellious boy, impulsive, unconscious, has a appetite for risk and danger embodied in endless fights and illegal motorbike races, the limit of common sense",2010-12-03,es,7.724,3120
